{
  "author": "synthetic-fixture-author",
  "cases": [
    {
      "assertions": [],
      "case_id": "case_stripe_baseline",
      "classification": "no_drift",
      "connector": "stripe",
      "expected_output": null,
      "http_status": 200,
      "input": "fixtures/synthetic/stripe/baseline.json",
      "reason": "Independently authored synthetic consumer-compatible payload.",
      "taxonomy": "baseline"
    },
    {
      "assertions": [
        {
          "after": "/data/object/metadata/display_label",
          "before": "/data/object/metadata/presentation/label",
          "kind": "value_equal"
        },
        {
          "after": "/id",
          "before": "/id",
          "kind": "value_equal"
        },
        {
          "after": "/type",
          "before": "/type",
          "kind": "value_equal"
        },
        {
          "after": "/data/object/id",
          "before": "/data/object/id",
          "kind": "value_equal"
        },
        {
          "kind": "unchanged_outside",
          "paths": [
            "/data/object/metadata/presentation/label",
            "/data/object/metadata/display_label"
          ]
        },
        {
          "kind": "absent",
          "path": "/data/object/metadata/presentation/label"
        }
      ],
      "case_id": "case_stripe_field-move",
      "classification": "repairable",
      "connector": "stripe",
      "expected_output": "fixtures/golden/stripe/field-move.json",
      "http_status": 200,
      "input": "fixtures/synthetic/stripe/field-move.json",
      "reason": "Explicit synthetic equivalence for a noncritical display/tracking field; no destination collision.",
      "taxonomy": "rename_move"
    },
    {
      "assertions": [],
      "case_id": "case_stripe_required-deletion",
      "classification": "unsupported",
      "connector": "stripe",
      "expected_output": null,
      "http_status": 200,
      "input": "fixtures/synthetic/stripe/required-deletion.json",
      "reason": "Required identity information is missing; never manufacture it.",
      "taxonomy": "deletion"
    },
    {
      "assertions": [],
      "case_id": "case_shopify_baseline",
      "classification": "no_drift",
      "connector": "shopify",
      "expected_output": null,
      "http_status": 200,
      "input": "fixtures/synthetic/shopify/baseline.json",
      "reason": "Independently authored synthetic consumer-compatible payload.",
      "taxonomy": "baseline"
    },
    {
      "assertions": [
        {
          "after": "/vendor",
          "before": "/details/vendor",
          "kind": "value_equal"
        },
        {
          "after": "/id",
          "before": "/id",
          "kind": "value_equal"
        },
        {
          "after": "/status",
          "before": "/status",
          "kind": "value_equal"
        },
        {
          "kind": "unchanged_outside",
          "paths": [
            "/details/vendor",
            "/vendor"
          ]
        },
        {
          "kind": "absent",
          "path": "/details/vendor"
        }
      ],
      "case_id": "case_shopify_field-move",
      "classification": "repairable",
      "connector": "shopify",
      "expected_output": "fixtures/golden/shopify/field-move.json",
      "http_status": 200,
      "input": "fixtures/synthetic/shopify/field-move.json",
      "reason": "Explicit synthetic equivalence for a noncritical display/tracking field; no destination collision.",
      "taxonomy": "rename_move"
    },
    {
      "assertions": [],
      "case_id": "case_shopify_required-deletion",
      "classification": "unsupported",
      "connector": "shopify",
      "expected_output": null,
      "http_status": 200,
      "input": "fixtures/synthetic/shopify/required-deletion.json",
      "reason": "Required identity information is missing; never manufacture it.",
      "taxonomy": "deletion"
    },
    {
      "assertions": [],
      "case_id": "case_netsuite_baseline",
      "classification": "no_drift",
      "connector": "netsuite",
      "expected_output": null,
      "http_status": 200,
      "input": "fixtures/synthetic/netsuite/baseline.json",
      "reason": "Independently authored synthetic consumer-compatible payload.",
      "taxonomy": "baseline"
    },
    {
      "assertions": [
        {
          "after": "/displayName",
          "before": "/presentation/displayName",
          "kind": "value_equal"
        },
        {
          "after": "/id",
          "before": "/id",
          "kind": "value_equal"
        },
        {
          "after": "/itemId",
          "before": "/itemId",
          "kind": "value_equal"
        },
        {
          "kind": "unchanged_outside",
          "paths": [
            "/presentation/displayName",
            "/displayName"
          ]
        },
        {
          "kind": "absent",
          "path": "/presentation/displayName"
        }
      ],
      "case_id": "case_netsuite_field-move",
      "classification": "repairable",
      "connector": "netsuite",
      "expected_output": "fixtures/golden/netsuite/field-move.json",
      "http_status": 200,
      "input": "fixtures/synthetic/netsuite/field-move.json",
      "reason": "Explicit synthetic equivalence for a noncritical display/tracking field; no destination collision.",
      "taxonomy": "rename_move"
    },
    {
      "assertions": [],
      "case_id": "case_netsuite_required-deletion",
      "classification": "unsupported",
      "connector": "netsuite",
      "expected_output": null,
      "http_status": 200,
      "input": "fixtures/synthetic/netsuite/required-deletion.json",
      "reason": "Required identity information is missing; never manufacture it.",
      "taxonomy": "deletion"
    },
    {
      "assertions": [],
      "case_id": "case_generic-json_baseline",
      "classification": "no_drift",
      "connector": "generic-json",
      "expected_output": null,
      "http_status": 200,
      "input": "fixtures/synthetic/generic-json/baseline.json",
      "reason": "Independently authored synthetic consumer-compatible payload.",
      "taxonomy": "baseline"
    },
    {
      "assertions": [
        {
          "after": "/shipment/tracking_number",
          "before": "/shipment/tracking/number",
          "kind": "value_equal"
        },
        {
          "after": "/id",
          "before": "/id",
          "kind": "value_equal"
        },
        {
          "after": "/shipment/id",
          "before": "/shipment/id",
          "kind": "value_equal"
        },
        {
          "after": "/shipment/status",
          "before": "/shipment/status",
          "kind": "value_equal"
        },
        {
          "after": "/shipment/weight_grams",
          "before": "/shipment/weight_grams",
          "kind": "value_equal"
        },
        {
          "kind": "unchanged_outside",
          "paths": [
            "/shipment/tracking/number",
            "/shipment/tracking_number"
          ]
        },
        {
          "kind": "absent",
          "path": "/shipment/tracking/number"
        }
      ],
      "case_id": "case_generic-json_field-move",
      "classification": "repairable",
      "connector": "generic-json",
      "expected_output": "fixtures/golden/generic-json/field-move.json",
      "http_status": 200,
      "input": "fixtures/synthetic/generic-json/field-move.json",
      "reason": "Explicit synthetic equivalence for a noncritical display/tracking field; no destination collision.",
      "taxonomy": "rename_move"
    },
    {
      "assertions": [],
      "case_id": "case_generic-json_required-deletion",
      "classification": "unsupported",
      "connector": "generic-json",
      "expected_output": null,
      "http_status": 200,
      "input": "fixtures/synthetic/generic-json/required-deletion.json",
      "reason": "Required identity information is missing; never manufacture it.",
      "taxonomy": "deletion"
    },
    {
      "assertions": [],
      "case_id": "case_generic-json_nullable",
      "classification": "unsupported",
      "connector": "generic-json",
      "expected_output": null,
      "http_status": 200,
      "input": "fixtures/synthetic/generic-json/nullable.json",
      "reason": "Null is not a missing or valid string tracking identifier.",
      "taxonomy": "nullable_missing"
    },
    {
      "assertions": [],
      "case_id": "case_generic-json_incompatible-type",
      "classification": "unsupported",
      "connector": "generic-json",
      "expected_output": null,
      "http_status": 200,
      "input": "fixtures/synthetic/generic-json/incompatible-type.json",
      "reason": "Opaque tracking identifiers must never be coerced to numbers.",
      "taxonomy": "incompatible_type"
    },
    {
      "assertions": [],
      "case_id": "case_generic-json_enum-change",
      "classification": "unsupported",
      "connector": "generic-json",
      "expected_output": null,
      "http_status": 200,
      "input": "fixtures/synthetic/generic-json/enum-change.json",
      "reason": "Unknown business state needs an owner decision.",
      "taxonomy": "enum_change"
    },
    {
      "assertions": [],
      "case_id": "case_generic-json_unit-change",
      "classification": "unsupported",
      "connector": "generic-json",
      "expected_output": null,
      "http_status": 200,
      "input": "fixtures/synthetic/generic-json/unit-change.json",
      "reason": "Schema-valid but wrong unit: shape validation cannot prove business meaning.",
      "taxonomy": "unit_change"
    },
    {
      "assertions": [],
      "case_id": "case_generic-json_missing",
      "classification": "unsupported",
      "connector": "generic-json",
      "expected_output": null,
      "http_status": 200,
      "input": "fixtures/synthetic/generic-json/missing.json",
      "reason": "Missing required tracking identifier has no equivalent source.",
      "taxonomy": "nullable_missing"
    },
    {
      "assertions": [],